{
  "$schema": "../../schema-json/machine.schema.json",
  "id": "machine.medbay_bed",
  "name": "Medbay Bed",
  "tags": ["bed"],
  "footprint": [
    {
      "x": 0,
      "y": 0
    }
  ],
  "interactionPositions": [
    {
      "key": "bedside",
      "offset": {
        "x": 1,
        "y": 0
      },
      "purposes": ["use"],
      "capacity": 1
    }
  ],
  "power": {
    "role": "none"
  },
  "heat": {
    "risePerSecond": 0,
    "coolPerSecond": 0,
    "derateAbove": 1
  },
  "operation": {
    "requiresOperator": false
  },
  "failure": {
    "baseHazardPerSecond": 0,
    "heatFactor": 0,
    "wearPerSecond": 0
  },
  "faults": [],
  "components": []
}
