{
  "$schema": "../../schema-json/machine.schema.json",
  "id": "machine.nav_terminal",
  "name": "Nav Terminal",
  "tags": ["navStation"],
  "footprint": [
    {
      "x": 0,
      "y": 0
    }
  ],
  "interactionPositions": [
    {
      "key": "seat",
      "offset": {
        "x": -1,
        "y": 0
      },
      "purposes": ["operate", "repair"],
      "capacity": 1
    }
  ],
  "power": {
    "role": "consumer",
    "drawKw": 0.2,
    "priority": "domestic",
    "partialPower": "off"
  },
  "heat": {
    "risePerSecond": 0,
    "coolPerSecond": 0,
    "derateAbove": 1
  },
  "operation": {
    "requiresOperator": false
  },
  "failure": {
    "baseHazardPerSecond": 0.00006,
    "heatFactor": 1,
    "wearPerSecond": 0
  },
  "faults": [
    {
      "key": "chart_fault",
      "name": "Corrupted chart store",
      "weight": 1,
      "effect": {
        "kind": "inoperable"
      },
      "symptom": {
        "key": "chart_checksum_error",
        "channel": "sensor"
      },
      "repair": {
        "steps": [
          {
            "key": "scan_chart_store",
            "action": "inspect",
            "workSeconds": 8,
            "tools": ["diagnosticScanner"],
            "consumes": [],
            "at": "repair",
            "skill": {
              "skill": "electrical",
              "min": 1
            }
          },
          {
            "key": "reload_charts",
            "action": "repair",
            "workSeconds": 15,
            "tools": ["diagnosticScanner"],
            "consumes": [],
            "at": "repair",
            "skill": {
              "skill": "electrical",
              "min": 1
            }
          },
          {
            "key": "test_plot",
            "action": "test",
            "workSeconds": 5,
            "tools": [],
            "consumes": [],
            "at": "repair"
          }
        ]
      }
    }
  ],
  "components": []
}
