{
  "$schema": "../../schema-json/machine.schema.json",
  "id": "machine.life_support",
  "name": "Life Support Unit",
  "tags": ["lifeSupport"],
  "footprint": [
    {
      "x": 0,
      "y": 0
    }
  ],
  "interactionPositions": [
    {
      "key": "side",
      "offset": {
        "x": 1,
        "y": 0
      },
      "purposes": ["repair"],
      "capacity": 1
    }
  ],
  "power": {
    "role": "consumer",
    "drawKw": 8,
    "priority": "lifeSupport",
    "partialPower": "derate"
  },
  "heat": {
    "risePerSecond": 0.004,
    "coolPerSecond": 0.01,
    "derateAbove": 0.85
  },
  "operation": {
    "requiresOperator": false
  },
  "failure": {
    "baseHazardPerSecond": 0.0004,
    "heatFactor": 2,
    "wearPerSecond": 0.0004
  },
  "faults": [],
  "components": [],
  "maintenance": {
    "intervalSeconds": 600,
    "inspect": {
      "key": "routine_inspect",
      "action": "inspect",
      "workSeconds": 10,
      "tools": ["multimeter"],
      "consumes": [],
      "at": "repair",
      "skill": {
        "skill": "engineering",
        "min": 1
      }
    },
    "conditionRestored": 1
  }
}
