{
  "$schema": "../../schema-json/machine.schema.json",
  "id": "machine.ops_terminal",
  "name": "Ops Terminal",
  "tags": ["opsStation"],
  "footprint": [
    {
      "x": 0,
      "y": 0
    }
  ],
  "interactionPositions": [
    {
      "key": "seat",
      "offset": {
        "x": -1,
        "y": 0
      },
      "purposes": ["operate"],
      "capacity": 1
    }
  ],
  "power": {
    "role": "consumer",
    "drawKw": 0.2,
    "priority": "domestic",
    "partialPower": "off"
  },
  "heat": {
    "risePerSecond": 0,
    "coolPerSecond": 0,
    "derateAbove": 1
  },
  "operation": {
    "requiresOperator": false
  },
  "failure": {
    "baseHazardPerSecond": 0,
    "heatFactor": 0,
    "wearPerSecond": 0
  },
  "faults": [],
  "components": []
}
