{
  "$schema": "../../schema-json/machine.schema.json",
  "id": "machine.coolant_pump",
  "name": "Coolant Pump",
  "tags": ["cooling"],
  "footprint": [
    {
      "x": 0,
      "y": 0
    }
  ],
  "interactionPositions": [
    {
      "key": "side",
      "offset": {
        "x": 1,
        "y": 0
      },
      "purposes": ["repair"],
      "capacity": 1
    }
  ],
  "power": {
    "role": "consumer",
    "drawKw": 6,
    "priority": "criticalCooling",
    "partialPower": "derate"
  },
  "heat": {
    "risePerSecond": 0.005,
    "coolPerSecond": 0.02,
    "derateAbove": 0.8
  },
  "operation": {
    "requiresOperator": false
  },
  "failure": {
    "baseHazardPerSecond": 0.0008,
    "heatFactor": 2,
    "wearPerSecond": 0.001
  },
  "faults": [
    {
      "key": "worn_bearing",
      "name": "Worn bearing",
      "weight": 1,
      "effect": {
        "kind": "derate",
        "outputFactor": 0.5
      },
      "symptom": {
        "key": "grinding_noise",
        "channel": "audible"
      },
      "repair": {
        "steps": [
          {
            "key": "remove_bearing",
            "action": "removeComponent",
            "workSeconds": 10,
            "tools": ["wrench"],
            "consumes": [],
            "at": "repair",
            "skill": {
              "skill": "engineering",
              "min": 2
            }
          },
          {
            "key": "install_bearing",
            "action": "installComponent",
            "workSeconds": 15,
            "tools": ["wrench"],
            "consumes": [
              {
                "itemDefId": "item.spare_parts_stack",
                "count": 1
              }
            ],
            "at": "repair",
            "skill": {
              "skill": "engineering",
              "min": 2
            }
          },
          {
            "key": "test_pump",
            "action": "test",
            "workSeconds": 5,
            "tools": [],
            "consumes": [],
            "at": "repair"
          }
        ]
      }
    }
  ],
  "components": [
    {
      "slot": "bearing",
      "itemDefId": "item.spare_parts_stack"
    }
  ]
}
